{
  "tag": "assisted-echo-t4-prereg-v1c",
  "grid": { "N": 1024, "dx": 1.0 },
  "params": { "c": 1.0, "m": 0.5, "D": 1.0, "r": 0.1, "u": 0.0, "m_lap_operator": "spectral" },
  "dt": 0.04,
  "steps": 200,
  "seeds": [1,2,3,4,5,6,7,8,9,10,11,12],
  "lambdas": [0.0, 0.1, 0.2, 0.3, 0.5],
  "budget": 0.03
}
